{
  "schema_version": "1.0.0",
  "id": "ed_2026-07-20",
  "date": "2026-07-20",
  "revision": 1,
  "status": "publicada",
  "timezone": "America/Sao_Paulo",
  "published_at": "2026-07-20T08:15:22-03:00",
  "sealed_at": null,
  "supersedes": null,
  "publications": [
    {
      "id": "pub_01K0ABCDEFFGHJKMNPQRSTVWXY",
      "position": 10,
      "featured": true
    }
  ]
}
